question,actual_output,expected_output
" Is one allowed to be on an “entertaining” WhatsApp group where sometimes the Admin shares videos and voice notes that contain Lashon Hora, Harassment to other Yidden, mocking of Rabonim etc.?","###question 
  Is one allowed to be on an “entertaining” WhatsApp group where sometimes the Admin shares videos and voice notes that contain Lashon Hora, Harassment to other Yidden, mocking of Rabonim etc.?.
 ###answer 
 
If there is no other way to communicate with the group, one may join.
If there is another way to communicate with the group, one should not join.
If one is already a member of the group, one should not participate in the group.
If one is already a member of the group and there is no other way to communicate with the group, one should not participate in the group.
If one is already a member of the group and there is no other way to communicate with the group, one should not participate in the group.
If one is already a member of the group and there is no other way to communicate with the group, one","If this is the sole purpose of the WhatsApp group, obviously it is absolutely forbidden.
Even if the WhatsApp group contains other “kosher” entertainment, and one has the practical ability to skip over all the forbidden sections (which needs to be properly determined if this is at all practically possible), one may not rely on one’s temerity that they will avoid reading or viewing the un-kosher sections, unless this is their only necessary outlet for such “kosher” entertainment.
As a general principle: Wherever one has a choice to avoid situations where they might confront negative thoughts or behaviors, they are obligated to do so according to Halacha. In cases where this is the only method available for them to receive that which they require, then they may use this channel but must avoid doing (viewing, reading etc.) that which is forbidden.
This principle applies also to walking down the street in a place where one knows in advance that they will encounter immodest sights.
Of course, none of this takes into account the serious issue of Bittul Torah, which is a separate matter altogether. We are obviously discussing a case where for whatever reason this issue is not relevant.
היסוד – ב״ב נז, ב וברשב״ם שם. אבל ראה יד רמה שם. מרומי שדה שם. ולמעשה הפוסקים נקטו כרשב״ם.
בגדר דרכא אחריתי – ראה תוס׳ ע״ז מח, ב ד״ה אי. שו״ע יו״ד קמב, ט.
וראה אג״מ אה״ע ב, יד.
וכתבנו להקל גם כשאינו צורך ממש, אף שבשו״ת אג״מ אה״ע א, נו, כתב שטיול אינו בכלל ליכא דרכא אחריתי – ראה מה שחילק בס׳ שלהי דקייטא ע׳ צז.
ולהעיר בכ״ז מח״ח ו אות ה ובבאמ״ח יד ובהגה שר״ל דהא דבליכא דרכא אחריתי איבעי לי׳ למינס נפשי׳ הוא רק  בעריות, שה״ז הנאה הבאה לו בע״כ ולא קמכוון. ועיי״ש לגבי שמיעת לשה״ר. והביאו גם בשו״ת שלמת חיים אה״ע ס. והוא מחודש. גם צ״ע שהרי ע״ז חמירא טפי – ראה עירובין יח, ב. ע״ז יז, א. וגם ל׳ הרשב״ם הרחק מן הכיעור מ׳ קצת שהוא דין כללי. וצע״ע. ובכל הפוסקים ל״מ כן. וראה גם בשו״ת תורה לשמה שצד שנקט להך היתרא  גם בעריות. ולפלא שלא העיר מסוגיא דנשים על הכביסה. ולדבריו, צ״ל וליישב כדלקמן. וע״ק שלפ״ז הרי גם בגזל ליתסר אפי׳ באפשר ולא מכוון לפי שנפשו של אדם מחמדתן (וראה חגיגה יא, ב), ומוכח להדיא בפסחים כו, ב שבשוטחה לצרכה מהני גם הך היתרא. ודברי הש״ך קמב, לד, שהביא שם בבאמ״ח – היינו רק מצד גדרי איסור הנאה שבאה לו בע״כ, ולא מצד גוף האיסור ליכנס לנסיון. וראה דברות משה שבת כו, ל, שכניסה לנסיון בכל האיסורים – איסור דאורייתא. וי״ל בפשיטות, וכנראה כ״ד התורה לשמה, דבגמ׳ מיירי ביודע שיבוא ליהנות. ועפ״ז מובן גם בנדוננו. ובאמת זהו תו״ד הח״ח, שבעריות ל״ש שלא ייהנה. ובסגנון אחר י״ל, שעל גוף הרהור ל״ש היתר דלא מכוון. וקרוב הוא לד׳ הח״ח. ומזה מובן גם בנדו״ד.
ועוד ועיקר, שאף שסברת הח״ח שם גם להתיר בדאיכא דרכא אחריתי – הרי כתב שם להדיא בפנים מצוה לצאת מהחבורה. ורק בדאא״פ וגם אינו יכול לסתום אזניו שחושש שילעגו מותר להיות שם בכו״כ תנאים. וראה בריטב״א ע״ז מח, ב בטעם שבדאיכא דרכא אחריתי רשע הוא, אף דלא מכוון ובאה לו בעל כרחו. ווכעי״ז בחדא״ג מהרש״א ב״ב שם. וראה גם הערת המהדיר לריטב״א שם. וא״ש דנק׳ מכוון ומזיד, או עכ״פ קרוב וסרה קושיית הח״ח.  ובאמת הח״ח עצמו הב״ד ריטב״א שם בבאמ״ח יז. ועיי״ש, דס״ל שההיתר בדרכא אחריני רק כשיש צורך ממש."
"Is it allowed to vote in the following to help make the land of Israel frumer? They ask for affirmation on Zionism, that is NOT the Rebbe’s shita. Attached is what one needs to agree to to.
Here is the link to the Frum slate site: Eretzhakodesh.org","###question 
 Is it allowed to vote in the following to help make the land of Israel frumer? They ask for affirmation on Zionism, that is NOT the Rebbe’s shita. Attached is what one needs to agree to to.
Here is the link to the Frum slate site: Eretzhakodesh.org.
 ###answer 
 
The Rebbe’s shita is that one should not support any political party or candidate.
The Rebbe’s shita is that one should not support any political party or candidate.
The Rebbe’s shita is that one should not support any political party or candidate.
The Rebbe’s shita is that one should not support any political party or candidate.
The Rebbe’s shita is that one should not support any political party or candidate.
The Rebbe’s shita is that one should not support any political party","
There are several issues at play here and we will attempt to analyze them one by one.
Endorsement of a secular organization:
Though voting is somewhat of an endorsement of the organization at large, it appears to me that this is the same as voting for Knesset, which has been encouraged by virtually all gedolei Yisroel. I have subsequently heard the same opinion from another contemporary Posek who shared with me his position as above.
This is very different to joining the Synagogue council of America, something which was banned by gedolei Yisroel, as it indicates a recognition of movements who deny the creeds of our faith, among them the authenticity of Torah. The key distinction is that this organization is purely a secular organization and contains no religious significance whatsoever."
 Does one need to ask a Rav before being induced? Is there any Halachic issue?,"###question 
  Does one need to ask a Rav before being induced? Is there any Halachic issue?.
 ###answer 
 
There is no need to ask a Rav.
There is no Halachic issue.
However, it is important to note that the medical professionals should be informed that you are not doing it for medical reasons.
See here:
Can I be induced for medical reasons?
See here:
Can I be induced for medical reasons?
See here:
Can I be induced for medical reasons?
See here:
Can I be induced for medical reasons?
See here:
Can I be induced for medical reasons?
See here:
Can I be induced for medical reasons?
See here:
Can I be induced for medical reasons?
See here:
Can I be induced for medical reasons?
See here:
Can I be induced for medical reasons?
See here:
Can I be","
This matter is discussed in a number of Poskim. The general rule is that one may not induce or rush the onset of labor unless there are clear medical reasons to require it. Some of the reasons for this prohibition are because:
There is a level of risk inherent to childbirth, and one should therefore not hasten it even though it is bound to come.
The special assurance of protection Hashem provides at the time of childbirth does not necessarily apply to the same degree if the birth is hastened without a clear medical need.
The procedures and/or medicines involved in induction can themselves cause complications, and one should not take that risk needlessly."
 האם מותר לאבל לרקוד בפורים או עכ”פ (אם יש חילוק) בשעת הסעודה?,"###question 
  האם מותר לאבל לרקוד בפורים או עכ”פ (אם יש חילוק) בשעת הסעודה?.
 ###answer 
 אין הלכה שאפשר להרקוד בפורים בשעת הסעודה. אם היה לאבל לרקוד בפורים או עכ”פ בשעת הסעודה היה להרקוד בשעת הסעודה ולא להרקוד בפורים.
","אין לאבל לרקוד וגם בשעת הסעודה. אבל מותר לו לרקוד מעט בביתו ביחיד, אם דרכו כך בכל שנה.
אם מדובר באופן שמניעתו מלרקוד תתפרש כאבילות בפרהסיא, כגון במקרה שרגיל לרקוד בפרהסיא בסעודה, מותר לרקוד כדי שלא יהיה אבלות בפרהסיא.
מראה מקומות:
שאין לנהוג אבלות בפרהסיא בפורים – ראה בשו”ע או”ח סימן תרצו סעיף ד בהגהה. וראה כאן:
I am an Avel r”l, And I run a campus Chabad House. Am I allowed to have music playing during our Purim celebrations?
שאסור לרקוד – כ״כ בתשובות והנהגות חלק ו סימן קסג אות ב, ללא מקור.
ויש לדון דלכאו׳ שמחה דידי׳ הוא וכאבל לאחר ל׳ שמותר לישא אשה – שמותר לו גם לרקוד. [ומש״כ במג״א תרצו, לאסור לראות כל מיני שמחה – היינו תוך ז׳. וגם יתכן דמיירי בשמחה יתירה על הרגיל. ועוד, שבא״ר שם ה, הביאו בפמ״ג בא״א ז. ועוד, חולק].
ואכן, בשו״ת זקן אהרן (הקדמון) ריג – והו״ד בשו״ת חיים שאל א, כא, ובעיקרי הד״ט או״ח לו, כג, בפת״ש תרצו, ד, ובכה״ח תרצו, כו, שאבלות ל׳ ויב״ח לכו״ע אינה נוהגת בפורים, מטעם ששמחה המחוייבת היא. וכ״ה בשו״ת פעולת צדיק ב, עח. דע״ת שצא, ג. טוב לכת שם ג. [וחלקם כתבו משמו להתיר גם אחר ז׳ לשאר קרובים. אבל בפנים כתב רק אחר ל׳]. ואף דמיירי התם במי שכך מלאכתו ופרנסתו לנגן, וכתב שם בל׳ השאלה ״שאין לו מלאכה אחרת אלא זו״ (ומשמע קצת שההיתר משום הפסד). והרבה פוסקים העתיקו דבריו רק בכה״ג (אבל השמיטו שאין לו מלאכה אחרת) אבל מתו״ד נראה בעליל שטעמו להתיר גם בלא״ה, ועיקר סמיכתו לפי שמחוייב בשמחה, עייש״ב. (וידוע השקו״ט בכללי ההוראה כשפוסק כותב להתיר מתרי טעמי, אם אפשר להתיר גם ללא כל הצירופים).
ואף שמובן שגם בפורים ישנם הגבלות במניעת משלו״מ מרובים וכו׳ – אבל הכא קיימינן לגבי שמחה. ובנמוקי או״ח תרצו, ה חילק באו״א.
אבל לאידך, הרי בשמח״ת אסרו ברקודים אף ששמחה שלו היא, ראה בכף החיים או”ח תרסט, לג וגשר החיים כג, ז. וגם ביו״ט לא מצינו בשום דוכתא להתיר, אף שמחוייב בשמחה. (אבל בזקן אהרן גופא  נז׳ בין השיטין גם יו״ט. ולא הוב״ד בפוסקים). אולם, יו״ט שאני שחיובו רק בבשר ויין, משא״כ בפורים שמצותו בשמחה מצ״ע. וגם בשמח״ת השמחה רק לכבוד התורה ואינה שמחה המחוייבת. וראה בדה״ש שצא, ל ובביאורים לשם שכשיש כלי זמר ה״ז ע״ד בית המשתה. וכ״ה בחזו״ע פורים ע׳ קפ.
ולפ״ז עדיף טפי רקודים וכלי זמר ביחיד, שאין בזה גדר בית המשתה – ראה גם תורת המועדים פורים ע׳ תכח בשם הגריש״א. אבל ראה וישמע משה משמו ע׳ שלב.
ולמעשה, כיון שאפשר בלא״ה (וכן יל״פ בכוונת המג״א שאסור לו לראות מיני שמחה, ובישוב קושיית הא״ר, , שכיון שאבילות נוהגת בצינעא, עכצ״ל שיש לו למעט בשמחתו בדאפשר במקום שאין הכרח), וגם שבכ״מ כתבו להתיר רק למי שכך פרנסתו, וגם בנימוקי או״ח דלעיל כתב להתיר רק כשבאו כבר המזמרים וכדו׳ ולא כשאפשר למנוע מראש, לכן כתבנו כבפנים."
" How to properly reward children for their good behavior?
Question:
When rewarding good behavior, Is it at all oisgehalten to choose certain missions that are mandatory, meaning if they miss those mandatory ones, they will not get rewarded for the other (non-mandatory) missions? I know that we always tell people on mivtzoim “even though you just ate non-Kosher it’s irrelevant whether or not to put on tefillin now”.
My question is when it comes to chinuch does that same rule apply?","###question 
  How to properly reward children for their good behavior?
Question:
When rewarding good behavior, Is it at all oisgehalten to choose certain missions that are mandatory, meaning if they miss those mandatory ones, they will not get rewarded for the other (non-mandatory) missions? I know that we always tell people on mivtzoim “even though you just ate non-Kosher it’s irrelevant whether or not to put on tefillin now”.
My question is when it comes to chinuch does that same rule apply?.
 ###answer 
 
It is not recommended to use the reward as a means of coercion.
If you want to reward them for their good behavior, you should reward them for the good behavior itself, and not for the fact that they did not miss the mandatory mitzvos.
If you want to encourage them to do","
You may choose whichever system works for you or for the purpose you’re trying to achieve. Furthermore, there might be a particular advantage in using the system that you have outlined. A reward system by nature indicates that what the child is doing is something extra, not required. When you start rewarding for behaviors which are expected from the children it subtly implies that these behaviors are not obligatory behaviors. For example, we don’t normally reward children for keeping Shabbos. If we have a reward system for observing Tznius, we are implying that tznius is an extra unnecessary commitment."
 מה דעת כת”ר בקשר לאות ל באלקינו. האפשר לצרף גוף האות ל ואז האות ו הוא בגודל מספיק?,"###question 
  מה דעת כת”ר בקשר לאות ל באלקינו. האפשר לצרף גוף האות ל ואז האות ו הוא בגודל מספיק?.
 ###answer 
 אין לי להסכים על הדיון שלא יהיו אותים של אלקינו כדי שיהיו אותים של השם בכל מקום. אבל אין לי להסכים על הדיון","מענה:
בנוגע אורך הצואר שבאות ל׳ – דיברנו מזה בעבר, שהרבה מכשירים בדיעבד – ראה קסה״ס ה לשכת הסופר יז. גדולי הקדש יב, יג ואילך. שו״ת דברי חיים ב, יו״ד קלא. בית שלמה ב יו״ד קכ. ועוד. וכאן יש לסמוך על האומרים שעובי מצטרף כיון שהצואר בסופו – אמרי שפר ה הע׳ ד. קול יעקב ועוד. ו
ובלא״ה דעת אדה״ז משמע שהוא רק לכתחילה."
 Can a Sefardi fulfill his biblical obligation of hearing Parashas Zachor in an Ashkenazy shul / Ba’al koreh?,"###question 
  Can a Sefardi fulfill his biblical obligation of hearing Parashas Zachor in an Ashkenazy shul / Ba’al koreh?.
 ###answer 
 
Yes.
See here:
Can a Sefardi fulfill his biblical obligation of hearing Parashas Zachor in an Ashkenazy shul / Ba’al koreh?
See also here:
Can a Sefardi fulfill his biblical obligation of hearing Parashas Zachor in an Ashkenazy shul / Ba’al koreh?
See also here:
Can a Sefardi fulfill his biblical obligation of hearing Parashas Zachor in an Ashkenazy shul / Ba’al koreh?
See also here:
Can a Sefardi fulfill his biblical obligation of hearing Parashas Zachor in an Ash","Yes.
Some Sefardim are mehader to use Sefardi Sefer Torah and baal korei (and vice versa), but this isn’t me’akev, it not something that is necessary.
ראה שו״ת הרא״ש ג, יא. קרית ספר להמאירי ב. מאירי שבת קג, א. ב״י יו״ד סוסי׳ ערה. אהלי יעקב למהריק״ש קיג. מהר״ם גאלאנטי קכד. חכ״צ צט. נוב״י קמא יו״ד פ. תנינא יו״ד קעא. צ״צ יו״ד רח. קנאת סופרים קכא. עין יצחק יו״ד כח, טו. מהרש״ם ז, קיב. יחו״ד ב, ג.
ולגבי ההברה – ראה שערי הלכה ומנהג א׳ ע׳ קיט ואילך. ובעניננו – ראה שו״ת בנין שלמה נד. יבי״א ו, יא. תפלה כהלכתה טז הע׳ נג בשם הגריש״א. מקראי קודש פורים (הררי) ב הע׳ מא בשם הגרשז״א. הליכות שלמה מועדים יח, א. ויש שה״ר משו״ת מהרי״ט ב, טז שגם בשיבוש כך אמירתו. ובשו״ת חת״ס ו, פו שמה״ת יוצא בכל לשון. וראה שרידי אש ב, ו. אג״מ או״ח ג, ה.
וראה גם בשיחת צום גדלי׳ וי״ג תשרי תשמ״ב."
 Is it allowed to eat spelt Matzah at the Seder instead of wheat Matzah?,"###question 
  Is it allowed to eat spelt Matzah at the Seder instead of wheat Matzah?.
 ###answer 
 
No.
See here:
Can I eat spelt matzah at the seder?
See also here:
Can I eat spelt matzah at the seder?
See also here:
Can I eat spelt matzah at the seder?
See also here:
Can I eat spelt matzah at the seder?
See also here:
Can I eat spelt matzah at the seder?
See also here:
Can I eat spelt matzah at the seder?
See also here:
Can I eat spelt matzah at the seder?
See also here:
Can I eat spelt matzah at the seder?
See also here:
Can I eat spelt matz","Spelt matzah may be used but it is a mitzvah min hamuvchar to use wheat. The Rama records that this is the custom. One shouldn’t veer away from this custom unless necessary. Some are concerned that we don’t have sufficient information about the leavening process of spelt and therefore it should be avoided unless absolutely required for health reasons.
רמ״א תנג, א. אדה״ז שם ב. משנ״ב ב. הגהות מהרש״ם לארחות חיים ספינקא שם. שו״ת לבושי מרדכי ב, קמח. מנח״י ט, מט. חשב האפוד ג, ט. שרגה״מ ה, ח (ושם גם מש״כ אליו בעל מנח״י)."
Some times the Rebbe said that there is the gezeira against Mashke on Purim regarding Bochrim and sometimes the Rebbe said that there is no gezeira. What should I do?,"###question 
 Some times the Rebbe said that there is the gezeira against Mashke on Purim regarding Bochrim and sometimes the Rebbe said that there is no gezeira. What should I do?.
 ###answer 
 
The Rebbe said that there is a gezeira against Mashke on Purim regarding Bochrim.
See here:
שו”ע אדה”ז יו”ד סי’ קלא סעי’ קלא א. וראה גם בשו”ע אדה”ז יו”ד סי’ קלא סעי’ קלא ב. וראה גם בשו”ע אדה”ז יו”ד סי’ קלא סעי’","
There is no doubt that the gezeira against mashke is applicable Purim too.
See here."
" יש לנו ילדים שיחיו כבר אחרי בר/בת מצווה, האם הם צריכים לקרוא ק”ש, שמו”ע וברה”מ דווקא באנגלית (כדי שיבינו)?","###question 
  יש לנו ילדים שיחיו כבר אחרי בר/בת מצווה, האם הם צריכים לקרוא ק”ש, שמו”ע וברה”מ דווקא באנגלית (כדי שיבינו)?.
 ###answer 
 
אם הם ילדים שיחו כבר אחרי בר/בת מצווה, הם צריכים לקרוא ק”ש. אם הם לא ילדים, הם צריכ","לא.
אבל מוכרח שיידעו פירוש פסוק ראשון בקריאת שמע ופירוש ברכה ראשונה של שמונה עשרה.
(ונכון, שיידעו גם פירוש עיקר הברכות בברכת המזון – ברוך ה׳ ומלכות וענין הברכה שמברך עליו, ובברכה ראשונה – פתיחת וחתימת הברכה.
וכדאי גם בשאר ברכות לדעת פירוש עיקר הברכה, ובברכות ארוכות הפותחות וחותמות בברוך – פתיחת וחתימת הברכה).
מקורות:
ראה בפרטיות שו״ע אדה״ז קפה, א-ב. שם סוסי׳ קא. ועוד.
וראה משנה ברורה סב, ג: וכל זה מצד הדין אבל למצוה מן המובחר הוא דוקא בלשון הקודש כן כתב הב”ח בסימן קצ”ג ועיין בספרי האחרונים דבימינו [והוא משו״ת רעק״א דלקמן] אף מצד הדין יש ליזהר שלא לקרותה בלשון אחר כי אם בלשון הקודש, כי יש כמה וכמה תיבות שאין אנו יודעים איך להעתיקם היטב כגון תיבת ושננתם יש בו כמה ביאורים אחד לשון לימוד ואחד לשון חידוד כמו שאמרו חז”ל שיהו דברי תורה מחודדין בפיך שאם ישאלך אדם דבר אל תגמגם ותאמר לו. וכן כמה וכמה תיבות שבקריאת שמע שאין אנו יודעין היטב ביאורו על לשון אחר כגון תיבת את ותיבת לטוטפות וכדומה, אבל כשאנו קוראין שמע בלשון הקודש וכן בתפלה וברכת המזון וקידוש ושארי ברכות אפילו אם אינו מבין הלשון יצא דזה אינו מצוי שבן ישראל לא ידע ביאור הפסוק ראשון שבקריאת שמע שהכונה בו לעיכובא וכמו שכתוב בסימן ס”ג ס”ד.
ועוד ילה״ע מפלוגתת הרמב״ם והראב״ד ק״ש ב, י בגדר הדקדוק בכל לשון. ומשמע קצת שלראב״ד יזהר בתרגומו לדייק יותר בפירוש התוכן מדיוק המלים. וא״כ לדידן צ׳ ליזהר לתרגם בדיוק. כן להעיר משו״ת רעק״א החדשות ב (בהוצאת המאור, רביעאה ט. ובחי׳ רעק״א מגילה יז) שנסתפק בקורא בלעז  אם צ״ל כסדר התיבות בלה״ק, ולדוגמא הדברים האלה – these words, שנמצא שקרא למפרע שתירגם האלה לפני הדברים. והרי לא נהוג לתרגם כך. (אבל להעיר מרש״ש מגילה יז, ב תוד״ה דכתיב). ועו״ש שיש תיבות שאין מתרגמים בכלל, כגון שמוע תשמעו, שמשמיטים תיבות שמוע. (אבל ראה שו״ת חלקת יואב תנינא  א, בסופו, נוטה קצת שאפי׳ בדברים שצ״ל בלה״ק דוקא א״צ שיאמר הלשון הכתוב בתורה, ורק בברכת כהנים וכל היכא דכתיב כה וככה לעיכובא הוא בלשון זה דוקא. וא״כ כש״כ בק״ש שהוא בכל לשון. ואוי״ל ע״פ ברש״י מגילה ברכות יג, א ד״ה מדברים, שפי׳ למפרע שקרא ובשעריך ביתך מזוזות, שהקשה בטו״א מגילה יז, א שלכאו׳ אין לו משמעות ובלא״ה לא יצא, וראה אצלנו 22535 – שבדוקא נקט כך שבאופן זה כשקורא למפרע אין לו משמעות. אמנם, למעשה לא קייל״ן הכי. וגם בשינה סדר הפסוקים לא יצא ורק בשינה סדר הפרשיות יצא)."
