question,actual_output,expected_output
Can you please shed any light on it?,"
This is indeed true. However one may not use these in place of real Shabbos candles.</s>","
That Siddur has been around for ages.
This is a misrepresentation of what Reb Chayim Vital has written. He writes that he will point out the corrections to the Nusach Hatefillah, in accordance with this particular Siddur. Some have taken that to mean that in all matters that are not addressed by Reb Chayim Vital we ought to follow the nusach of that Siddur. There is no evidence that this is the case. All authorities who prepared Siddurim according to the Nusach Ha’ari did not take this approach."
" I sometimes Daven Mincha at a Shul that doesn’t say Tachanun, should I be saying myself?","
Yes.</s>","When davening minchah with that minyan you may skip tachanun. However, if at all possible, you should say it privately in a way that’s not noticeable."
 Is there any problem being Mafsik between any of the parts of Birchos Hashachar?,"
Yes. There is no room for this.</source>","One should not make an interruption at the following stages:
After washing hands before the Bracha of Al netilas yodayim.
Between the Bracha of Asher yotzar and Elokai neshoma.
From the beginning of the Bracha of Hamaavir sheina until concluding the words hagomel chasadim tovim le’amo yisroel.
Between the Brachos of Birchas HaTorah themselves and between finishing Birchas Hatorah and the pesukim of Birchas Kohanim.
Even when saying the other Brachos, one should not unnecessarily delay reciting them when waking up by making lengthy interruptions, as they are supposed to be said as close as possible to waking up."
" Do I have to add wine to the Becher of Havdalah after the Bracha on the fire?
And is there an inyan to do so by kiddush too if wine pours off the becher during kiddush?","
If it was poured before Shabbos or Yom Tov and did not fall onto food that will get eaten – one may leave out. If however this occurred while Kaddosh Leibad Minocho - even water can’t help.</p>","
Yes, the cup should be refilled if it spills and is not full before the Beracha of Havdala (or kiddush) and certainly if it is not full before the Beracha of Hagafen is said."
 Does the Halacha of not walking between two palm trees apply only if there are dates growing on them or even if not?,"
If they’re already bearing fruit.</s>","There’s no conclusive evidence one way or another about this topic. If, however, it’s a type of tree that naturally cannot produce dates, it would not be considered a palm tree.
P.S. If there’s a public thoroughfare between the two trees, there is more room for leniency. Moreover, if they are not parallel to each other or if they’re more than four Amos apart, it is not an issue in any case."
 Are you allowed to eat your finger nails?,"
Yes.</s>",No.
 What is the Halacha regarding Hefsek for Devarim Shebikdusha during Bentching?,"
One should be careful not too take one’s time while bentschening and make sure that he finishes before Shemoneh Esrei. If there will definitely no problem with this in your case it would even better if done quickly.</source>","Question:
While learning through some of the halachos of hefsek betfillah, I’ve come across some arguments and uncertainties, and I’d like to ask Harav Braun Shlita if he can please clarify halacha l’maase what the Halacha is regarding Hefsek for Devarim Shebikdusha, Modim, etc. during bentching (including the fourth Bracha – if it is any different).
Amswer:
One should not make a hefsek in benching also for Devarim Shebikdusha, just like in Shmonei Esrei. However, one may answer Amen to the Bracha of the mezamen between one Bracha and the next.
During the fourth Bracha one may be mafsik like in psukei dezimra."
" After losing my husband, I Baruch Hashem got remarried. Do I still participate in my previous husband’s Yartzheit Seudah?","
Yes.</sol>",It is not proper to do so.
"If it is difficult for me to daven by a very early minyan in town, and I’d prefer to drive and catch a later minyan that is close to where I work, is this permissible? (I may have less traffic in the commute by davening close to work, as well).","
It would be best not do so. However if there will only likely cause yourself some extra inconvenience but no harm then one could consider doing such.</s>","
Yes, it is permitted in this case if you would be able to daven better. However, you should recite Birchas Hashacher before the drive."
" Can I walk down the street with my sister?
I am a bochur in 770 and I have a sister in Crown Heights for the year, and we would like to meet up sometimes on the street or go for a walk to talk. (It’s hard to find a private place where we can both be). Is there a problem of tznius? If so is there a way we can avoid the problem?","
Yes it has halachic issues.</ s> See here regarding walking together</a>. See also below about going out alone which should not cause any problems as long one does everything within her power that people won't think she walks around men by herself just because they see your brother/other guy(in this case two brothers.) You could tell them if asked what do u mean when saying ""going outside"" - “just me” – without explaining further but still make sure its clear enough everyone knows exactly who will accompany whom from doorstep until reaching destination including all times spent while moving along etc., even though most know already anyway since ur coming back home same day…Also ask locals beforehand whether many women come through their area unaccompanied late at night too often during summer months especially after Chatzos Shabbosos; otherwise take an alternative route altogether! Additionally note how much time passes between shkias hakodesh till sundown plus add some extra minutes due possible delays caused either ways ecteter et caterwauling into consideration above mentioned points throughout entire period unless other arrangements were made prior agreement amongst group members involved making things work accordingly then no issue occurs except only common sense precautions apply whenever dealing directly face-to=face wth strangers such cases require special attention towards personal modesty requirements given circumstances surrounding those particular situations specifically these days being extremely sensitive matters relating more particularly against Tzenius laws pertaining our community thus warrant greater sensitivity than usual hence proper planning ahead ensures safety first priority always comes last over comfort second followed closely behind thirdly ease fourth fifth sixth sevenths eight nineth ten elevententh twelftheleven hundred twenty six thousand four hunfed seven score nine zero five three point twelve eleven thirty–seveen forty sixty thirteen eighteeneightyeighteenth ninetythrettywenty foureyettyeighth hundredsix","
Although there is no direct halachic problem, halachic sources indicate that a Talmid Chacham should only do so in a place where people know that it is his sister. Accordingly, it’s best you find a secluded area or you should ask someone if they could allow you to use their home for this purpose.
You may wish to discuss it also with your Mashpia."
" Can I ‘switch’ a Bracha in its midst?
If I had vegetables and chicken on my plate, and I stuck my fork into a vegetable and began making Ha’adama, but remembered by the word “ha’olam” that I already made Ha’adama on melon just before (when this plate was already in front of me):
A. I instinctively released the vegetable from the fork, stuck it into some chicken, and finished off the Bracha as Shehakol — does that Bracha count even though it was begun with the intent to say Ha’adama? Or must I repeat Shehakol over again?
B. At the point in time of catching myself by “ha’olam” — what is the best course of action? To say Boruch Sheim, or conclude it as a Bracha that is applicable (like Shehakol), even though it is different than the original intention?","
The issue here seems quite complex – there may be room for leniency regarding part A below; however we will not address Part B at all.</s>","
A. After the fact, it counts, and no need to repeat it.
B. Initially, you should say Baruch Sheim and not conclude with a different applicable Bracha."
Is this in fact the case?,"
Yes. See here.</s>","
This is true in theory. In practice, the custom is not to put them in a keli sheni."
 Does a chicken coop or run need a Mezuza?,"
No.</s>","Yes. The mezuzah should be covered.
If it’s used regularly for releasing their bodily waste, a mezuzah should not be placed."
"Are pringles with an OU Fine?
I spoke to one of the Rabbonim who told me that when they cook the potato to make it into potato starch they put all kinds of things in it that makes it not edible. It’s never in a situation that someone can eat it as mashed potatoes. Based on that it would seem that Pringles should have no issue with Bishul Yisroel, not even like Potato chips for it’s not made from potato but from the starch.
Can this issue be looked into again?","
It is indeed true what he said about how some companies produce their products.</span> The Chofetz Chaims explains why we don't rely solely upon “Bshu” and instead follow our own custom which requires additional factors such as mentioned above regarding food additives etc.,</p><br clear=all></div style=""background-color:#f0c547;borderRadius 1px;""> <h3 class='Cardo_Headline'>Potential issues related specifically herein include….. :<overscript size = +2 line height >A.) Food Additive Issues – Aside form being derived directly or indirect via other ingredients/additions there may still exist residual amounts within these substances due either through processing methods used during production & storage over time periods spanning decades since its first creation by removing any traces left behind at various points throughout history along those lines too if possible including anything added later afterward while also taking note whether certain items were produced prior 68 years ago without them containing pesticides yet nowadays almost none do unless otherwise stated below where allowed under halacha anyway despite having been tested many times beforehand just because sometimes people forget exactly everything especially details pertained thereto until much latter once more examination was conducted though most likely forgotten shortly therafter till then next inspection took place so thus resulting negligence might occur often enough making us lose track easily thereby causing confusion between actual numbers found versus whatever number(es), whichever applicable will apply accordingly depending mostly mainly only based off sampled data obtained last year assuming correctness given conditions allowable although perhaps less reliable than originally thought leading towards doubtful results overall whereas previously noted earlier instances involving non existence rather did actually happen right away therefore applying different set standards compared against similar past occurrences giving rise further complications downstream affectively changing current state outcomes however allowing same type product created using entirely"," 
I am not convinced that the information is accurate, nor am I convinced that adding ingredients to make it inedible will help in this case, especially if the ingredients are added after the cooking process has reached the stage of maachal ben drusai.
Question:
I called the OU, and I was told that the potatoes are cooked with steam, not in the regular way. So this might change your position about bishul yisroel Potato Chips and Pringles.
Answer:
This info doesn’t change the answer."
"I know the Rabbonim aren’t responsible for every rumor in their name, but being that this is something that can affect many women and I don’t want to make decisions based on rumors and hearsay, I just wanted to clarify, have the Rabbonim been getting a higher-than-normal amount of Shaalos from women who got vaccinated lasting for more than 1-2 cycles after the shot? And are there any concerns regarding Taharas Hamishpacha with getting the vaccine?","
There has not yet come up an issue which would cause concern. However it must be noted if one received two doses within six months she should wait at least until her next cycle before receiving another dose.</s>","
This information is incorrect. From my personal experience and after investigation with other rabbonim too, there is absolutely no basis for this rumor. This has been verified with Rabbonim who work specifically in the area of answering taharas hamishpacha questions full time, fielding Taharas Hamishpacha Hotlines, and heading a Beis Hora’ah for taharas hamishpacha matters.
There are many rumors, lies, half-truths and propaganda out there. In this matter specifically, I’ve heard so-called “reliable sources” quoting in the name of a particular well-known Rav, who deals regularly with taharas hamishpacha that he has seen such issues, only to find out upon investigation directly with him, that he too states that in his experience – as well as his investigation with others – this is untrue.
As always, I suggest that any information relating to medical issues such as vaccines should be gleaned from medical professionals and doctors. When there are conflicting opinions, as in any other matter, one should follow the majority opinion, the consensus established by mainstream doctors. This is the general halachic viewpoint, and particularly when it comes to medical issues.
This is all the more critical nowadays when there is an alarming rise in conspiracy theories on social media. The non-discerning individual, and many of us belong to that category, particularly if not steeped in a solid medical education, would have a difficult time being able to separate fact from fiction. Therefore, the first rule of thumb is not to believe anything shared about medical issues and everything must be checked and verified with the professionals.
See more about this here:"
 Can you make Lechem Mishnah with one challah still in its clear plastic bag when I don’t plan on using the second one anyway? Or must both challos be removed?,"
If there is no room for error and it will not affect anything else – yes. However if any other issue may arise because of this then we would advise against doing so.</s>","Ideally, it should be removed from the bag and both challos should be touching each other."
" Is the Chabad custom to recite the Kedusha D’sidra quietly?
I have noticed that it seems that Chabad minhag is for the chazan not to say the pesukim in kedusha d’sidra (“Uva LeTzion“) out loud. I understand saying the Targum quietly, but why the pesukim? Is this indeed the Chabad custom and what is the basis for it?","
The Rebbe said on several occasions during his lifetime about Shabbos Zichron Levavin – “One must always be careful when speaking of matters related with Pesach so as avoid any association between these words/topics from being associated by some people who may think they can learn how things were done back then.” The same applies regarding all other topics which we discuss throughout our lives.</S>","
Indeed, this is the common custom in many circles, especially among Chassidim, including Chabad. See references below."
" Is it okay to Lechatchila give a son Shvi’i and his father Maftir?
If not, what If the son was already called up for Shvi’i and the father is getting maftir cause he is a chiyuv, what should be done?","
It may also depend on how old your child will turn 13. For example if they were born in September or August of this year then next Pesach when all their siblings have turned Bar/Bat mitzvah age too – so that there would only one “shnitzer” among them which means everyone else can go ahead with shlichus etc….</s> You could try talking about something more interesting than just being mekareiv Hashem before giving him mizrach as well</e>. You might want consider teaching someone who does NOT get hafatzos like an older brother / sister first though; since its important we make sure our children understand why these things need doing especially during davening time where no-one has any other thing going at hand nor mind focused elsewhere besides pay attention because others around us do! It seems very few people know exactly WHY certain custom exists within Judaism but almost every person knows deep down inside themselves precisely HOW such practices came into existence through generations without ever having heard anyone explain anything along those lines unless perhaps reading books written by scholars from hundreds years ago—and even back THEN many times authors wouldn't reveal everything anyway due lack knowledge given circumstances surrounding each particular practice.” Regardless whatever choice made here–you must always keep reminding yourself throughout life whether young boy(old enough now), girlfriend[boy], husband wife —to continue learning Toras HaShalem together while sharing experiences gained thus far until reaching final goal achieved via study & actual living out lives based upon learned values found hidden amongst countlessly recorded stories appearing between pages filled words describing history unfolded across centuries past right onto present day today!”","
In general, there’s a Machlokes if a father and son (or son and father, or two brothers) can get Shvi’i and Maftir. In practice, it may only be done when these Aliyos are being read from two different Sifrei Torah (e.g., on a Shabbos Rosh Chodesh).
However, in a case of need, when one has a Chiyuv to receive an Aliyah (see below), one may rely on the lenient opinions and permit after the fact to call the father/son/brother for Maftir even in a regular case when both Aliyos are read from the same Sefer Torah. In this case, the first relative should leave the Bima before the second comes up for Maftir.
Consequently, in the case you mentioned, it would only be permitted (after the fact, as above) if the Yahrtzeit is on Shabbos. Being called up to Maftir during the year of mourning or on the Shabbos before a Yahrtzeit, however, is not considered a Chiyuv and in this case, the father should not be called up."
 Can a person call their step father by his first name if that is the title he would feel comfortable with?  And would it be better to add “Reb” or “Mr.”?,"
If your mother’s husband passed away and then she remarried someone else who was not married before this man – how do I refer him in my speeches about Shiva. He also doesn't want me calling out Mr., Reb etc.</p>","Yes, as long as their mother is fine with it."
 Can a Mezuzah be placed on a non-kosher restaurant?,"
If it is not being used for food or other activities that require kashrus. Otherwise no.</s>",No.
" How much Mezonos bread does one need to eat to be able to recite the Bracha after washing their hands?
I was a guest in a home and was served mezonos bread. I wanted to avoid any shailos of the bracha rishona and achrona and asked for additional bread made from flour and water. The host took out regular bread.
My question is: being that to recite al netilas yadayim, one needs to eat a kebeitza of bread. Do I need to have a full shiur of kebeitza from the lechem gamur to recite al netilas yadayim? Or can I wash on a small amount, a kezayis, of lechem gamur and use also the mezonos bread to allow me to recite al netilas yadayim?","
A Keitzer – about 1/4 cup or so- should suffice.</s>","
You would need to eat a kebeitza of proper bread in order to make the bracha of al netilas yadayim. Alternatively, if you’re going to be having the shiur of kvius seudah on the mezonos bread you make the bracha too.
You can also eat less than a kebeitza of bread, i.e. just a kezayis, and wash without reciting the bracha of al netilas yadayim."
 I generally wear a Kapota for all Yomei D’Pagra. May I wear one for Rosh Chodesh Kislev? I am in the midst of the Shloshim for my father.,"
Yes.</s>",No.
"I was not feeling well, so I made kiddush and drank a second cup of wine for kiddush bemakom seudah. I threw up a couple of hours later and all the wine from kiddush was thrown up, in this case, I did make myself throw up in order to provide some relief (which it did). Was I yotzei kiddush?","
You were Yoatzed Kaddesh.</s>","Answewr:
There is a machlokes about this. Therefore, one should not make kiddush again."
" Are there any halachic concerns with using a “crock pot plastic bag”?
I want to use a “crock pot plastic bag” to line the pot to prevent it from getting dirty – are there any halachic concerns with using these plastic bags?
(I also have a thin layer of foil around the heating element (under the actual pot) used as a blech).","
There is no concern.</s>","
Using a crockpot liner poses an issue of Hatmana. However, there won’t be an issue if there is a noticeable space between the majority of the bag and the pot’s walls. This can be achieved by either using a smaller bag that doesn’t touch the sides of the pot or not folding over the bag on two or more sides. Additionally, if using water, one must ensure that most of the bag is not immersed in the water."
 Should I cover the Bayis of the Tefillin Shel Yad with my sleeve?,"
Yes.</s>","The widespread Chabad custom is not to. If the case usually worn on the tefillin has holes in it, it’s recommended to cover the Shel Yad with the sleeve.
As for covering the Shel Yad when making the Brocha, see here:
I see a lot of people covering their Tefillin or their uncovered arm when they make the Bracha on Tefillin."
" If someone answered for a Zimun and then continued eating, can he join another Zimun?","
If one is already partaking of food in between two zimmuns there’s no need that they should wait until after finishing their meal. They may be seated with whomever wishes.</sm>","Yes, as long as he is one person joining two new people who didn’t hear zimun yet (and not two people who did hear zimun who are joining one person who did not hear zimun).
This applies only if he eats after the last zimun another kazayis of food or drinks a revi’s. The best would be if he eats another kazayis of bread. If he is joining a minyan of people in order to say “elokenu” then there is no preference in eating bread.
Similarly when it is a group of people eating together (not in a case where new people came and joined the meal after the zimun), and one joined two of the people in the group and made a zimun he may make another zimun with the rest even without eating more. If however there are only two people remaining that didn’t do zimun, they may only make zimun if they eat again (as in the first case).
P.S. Someone who heard zimun already may not be the one leading the zimun when joining others."
" Is there a point of putting on Tefillin with someone who has extra long hair?
Sometimes on mivtzoim I meet a Jew who wants to put on tefillin, but he has a “chup” or a huge ponytail is there any point of putting on tefillin (shel rosh) with him since it’s a chatzitza?","
You may do so. See here for more details.</see>","
Yes.
There is room for leniency even to make a Brocho on the Shel Rosh."
