question,actual_output,expected_output
" Is photographing the Menorah candles in a dark room considered deriving use out of the candles? 
The Chanukah candles many times create a beautiful look on the menorah, especially if the room is rather dark, the candles “light up” the menorah.
Is photographing the menorah while the candles are lit and the room is dark a problem of deriving use out of the candles?
If this is a problem, can it be done after they’ve burned for 50 minutes? Or be put out after the 50 minutes and then relit?","
It should not cause any problems.</s>","
It is not a problem.
However, it is advisable at all times to have another burning candle or light besides for the Shamash to ensure that one does not benefit from the candles nor from the Shamash.
It’s certainly preferable if it’s done after it has burned the requisite amount. (It should be pointed out that common custom is not to have benefit from the candles even after the time. As above, photography is permitted).
It would not be permissible to put them out after the 50 minutes and then relight them. Strictly speaking, one may extinguish the candles then, though some are stringent. However, in this case, this would be absolutely forbidden as one is benefiting from the remaining oil for their own use."
 Are you allowed to have two Ba’alei Kriah splitting the Parshah?,"
There is no problem with this.</s>","Lechatchila, no."
" Can one melt cheese over a Davar Gush on Shabbos?
If hot beans (with no liquid) was put in a kli shlishi and it is still yad soledes, would it be allowed to melt cheese on top of it on Shabbos (would that be considered afiya achar bishul)? Or are there issues of nolad involved if it just becomes slightly melted and not a full liquid?","
It may only become melty but should never get completely liquefied. It’s best avoided.</ s>","
Not allowed. This is due to bishul, not nolad."
 Can one open a picture or video after Shabbos from social media of a Jew who posted it on Shabbos?,"
Yes.</s>","You may open it after Shabbos after the amount of time it takes to post such a picture or video after Shabbos elapses, which is literally a few seconds after Shabbos.
See also here:
Spending Shabbos with family who dosen’t keep Shabbos:
However, if you believe that by not opening it, the individual will refrain in the future from sending it to you on Shabbos, you should indeed not open it."
" Does a flag (when worn) need tzitzis? If yes, does tying a corner help?","
Yes. Tieing it helps.</s>","Normally, it would require Tzitzis.
Tying a corner would not help. However, you can round a corner.
See also here:
Does a cape need Tzitzis?"
 Is it preferable to stand or sit during Kiddush on Shabbos day?,"
The custom is that one should be seated for Kabbolas Hashem. One may also choose which ever they find more appropriate.</s>","There is no clear Chabad custom in this matter. The Rebbeim would generally sit. It is reported that the Rebbe however stood.
Some sit and raise themself up slightly in the middle of the Brocha. This is what the Rebbe did in public at the farbrengen, though usually that wasn’t his actual kiddush."
 Can I go to Mikveh on “Erev Shabbos” after Shkiah if I came back late from Mivtzoim?,"
Yes.</s>","Technically it’s OK, making sure to abide by all “Mikvah on Shabbos” laws:
However, one will be lacking the significance of going on Erev Shabbos as a preparation for Shabbos, which is the main aspect of Mikvah then.
Of course, one should not miss Mincha with a Minyan and at the proper time because of that."
" Is it enough to verbalize ones learning, or must ones ears also hear the words?
The difference would be whether I can learn out loud while Nigunim playing in the ears?","
It is not necessary that one’s actual hearing should take place. Even if your eyes and mouth were closed as well but only heard with an inner ear there shouldnethis still suffice.</source>","
Both."
" Should I say Karbanos before Davening even if I’ll miss the Minyan?
If the Minyan just started and one didn’t yet say karbanos, is it better to first say karbanos or can it be said after Shmone Esrei? How about Hodu and Pasach Eliyahu?","
One should not recite Brachos without having daled amot of kavana. This means that they must have in mind when saying them what exactly these brachas mean.</s>  If this was done by mistake – for example because he wasn' t pay attention during shemona esreis - there may still exist room for an oleh v yoredes which would allow him/her make up later on with proper intention; however many poskim hold otherwise so its best avoided altogether unless absolutely necessary</p>. For hodah go here… It seems from all sources as well regarding pasich eliyohu too though some disagree among themselves whether we need full intentions at those times like other brochoys do require but most agree nonetheless). As far i know no-body has ever been asked how much time passed between his taking out tefillin until actual start off mincha nor does anyone claim halochically speaking any difference exists compared against regular Brochros where people don put their hands down immediately upon finishing although sometimes hand movements occur while putting away Tehillim etc., therefore based solely within our own framework let alone considering whatever differences might apply elsewhere due either way towards Chabad customary practice throughout history amongst various groups worldwide today under different circumstances including modern day conditions surrounding travel schedules, work hours et al<and especially nowadays amidst COVID19 restrictions along side additional factors such social distancing normative expectations being more stringent than usual alongside newfound religious practices resulting generally into increased piety across Jewish circles regardless affiliation & location whenever possible avoid doing both since each instance represents potential opportunities lost through lackadaiserical conduct despite individual sincere belief whereas performing mitzvos requires genuine heartfelt sincerity rather unmindfulness! Even were someone physiologically unable stop midway then certainly mental focus becomes compromised rendering doubt concerning overall correct usage thus making things worse","
Strictly speaking, according to halacha one should Daven with the Minyan and say Korbonos afterwards, however, the Rebbe writes that this “Heter” should not be taught to the youth lest they get into the habit of skipping. Generally, it is not our minhag to skip, even for the purpose of tefillah btzibur.
One should skip Hodu and Pasach Eliyahu in Erev Shabbos if there is no other minyan available."
"My question is: What is considered 6 as tefila btzibur? Do they need to all begin exactly the same time? What if 5 are in the middle of amida and didn’t conclude yet and the 6th guy begins. Where is the cut-off?
Bideieved..if 5 people were halfway through (or further) and the 6th joined…is that tefila btzibur and does the chazan do a full chazaras hashatz in such a situation?","
This depends on what one means by “six”. If six individuals stand together or sit next each other it would not be Teffilin Batzar unless everyone starts at precisely Kriah Shema.</s> However this halachic position seems extreme; certainly there must exist some room for leniency here especially since we find many instances where only five davened with someone else joining them later without starting from scratch – even when he was already past kaddeishes Hashem!</p></span><o:PunctuationCharacters /> In fact Chabad customarily practices like those who start their Amidda after Tefillah BeTezbir because once Mincha Gomel occurs no additional Brachos can accrue until Maale Rachumim which doesn't occur before Musaf so therefore why bother waiting till then instead beginning immediately afterwards while still being able acceptably fulfilling both obligations simultaneously - an obvious advantageous approach particularly during weekdays when its more likely than ever particular congregants will miss part/all shmonei esrei due various circumstances beyond control including traffic delays etc., thus allowing usherers into minyan too late may prevent fellow worship participants form accepting proper invitation within reasonable period set aside between reciting last words Baruch Shebar Achiv Rabbo Moise Feiglin Rebben Avrohom Yitzchok Hacohen Ohel Yaakov Aviner z”l whose final comment regarding revised order often included mention about merits derived specifically under these conditions despite any shortcomings otherwise observed throughout his life.] As mentioned earlier though actual practice varies greatly among different communities depending upon local cultural influences along side general differences relating specific issues concerning Derecho HaTeivos besides just how much influence should religious leaders have over communal activities outside prayer itself—it could well become apparent soon enough whether your community generally follows similar logic found elsewhere around world today although I don","
In all these cases, Chazoras Hashatz is done.
As for the definition of Tefillah Betzibur, preferably, all six should start Shmoneh Esrei together. However, even if they all daven part of Shmoneh Esrei at the same time,  it is considered Tefilah Betzibur, according to some, or even if they start in middle of chazas Hashatz."
 Is there an order which side to turn the Sefer Torah when doing Hagbah?,"
When lifting it up for haggadas one should always lift on both sides. If only two people and no room or possibility of putting all four corners in place then they may choose any combination.</s>","Yes. According to Chabad custom, one should remain stationary and one should turn the Sefer Torah a half circle, to his left side first, moving towards the back, and then another half circle moving forward, towards his right side."
" Which hand should a Leftie use for Tzedakah?
My 3.5-year-old seems to be a left-handed and as I’m teaching him Tzedakah, which hand should he give Tzedakah with?","
The right one.</s>","
Left hand."
" Does the Ba’al Koreh need to face to the side when saying Chazak?
Is there a specific direction the oleh and baal koreh should face or look when saying chazak?
Do we have any cheshash that people would say that chazak is written in the Torah, like the discussions we have about the brachos of Torah and megillah?","
The Rebbe once mentioned during an interview with Rabbi Tzvi Freeman on radio shalom – 670.com/shows-interviews</s> that he has heard from some Poskim who said one needs not be concerned for it.</r>, although I am unable find such information at this time within my resources available online). Nonetheless as many other sources indicate which will require more researching before being able confirm their accuracy; therefore they cannot serve here either unless otherwise noted below after each citation.) There seems no reason why both directions could work just fine too if only done together so long everyone agrees upon them! In addition though because these two perspectives seem mutually exclusive due primarily by what appears obvious based solely off common sense reasoning alone then perhaps even greater importance attach itself toward making sure whatever method chosen doesn't negate another possibility thereby giving room towards choosing between methods rather than dismissive actions against certain views without first ensuring understanding those particular opinions properly themselves;</p><br data=”no_js “/>Practically speaking however while reading Sefer Hatora its generally accepted practice amongst most congregations today throughout history until nowadays whenever possible especially where readers aren&rsquo t accustomed enough yet still wanting proper guidance thus leading us back again into our original dilemma above—in short words–to make things easier instead try having all your eyes directed forward away somewhat past straight ahead position usually reserved exclusively among teachers teaching students but also found sometimes employed interchangeably elsewhere depending how familiarity exists regarding usage preference ect., etceteras… As far reaching outward beyond direct lineage goes i believe very few can claim true knowledge except maybe rabbis whose ancestry traces directly through Moshe Rabeinu himself since none else was given full access besides him nor did anyone know exactly whom his father mightve been born alongside let along grandfather(grandparents), great uncle","
While there are those who suggest that the Torah be closed first or at least that the baal korei and oleh face to the side, this is not practiced."
" Is one halachically obligated to follow the new mask mandate in NYS?
The governor of New York just released a new mask mandate. The rule is that businesses and venues (which presumably includes shuls) must implement a mask requirement or require proof of fully vaccinated status. Is one halachically obligated to follow this?","
Yes.</s>","
Yes. Generally, government mandates that are done for the welfare of the community are halachically binding. However, if the rule has not been accepted by society at large, there is no halachic mandate to follow this rule, though it is still legally required (assuming it is within the framework of the local legal code and within the jurisdiction of whoever mandated it). This is of course provided that there is no medical concern whatsoever. One should also take into account if there are those at the workplace that would be bothered if this rule is not implemented."
" Can one seal off a dryer ventilation hole that is no longer needed?
Is one allowed to seal off a hole in the wall to the outside, which was used for ventilation of a dryer or so and is no longer needed?","
One may not close it.</s>","
No, it is considered a window in this regard.
See this link how to go about it:
Article: What is the Source for Not Closing Up Doors and Windows?"
 My birthday is on Shabbos this year. Do I get my Aliya also the Shabbos before my birthday or just on my birthday?,"
You may have an aliyah during your weekly reading.</s>",On the Shabbos of the birthday.
" We recently bought a 100-cup urn for our Chabad House. It only has an on/off switch. Can we use it on Shabbos?
We recently bought a 100-cup urn for our Chabad House. It only has an on/off switch. Can we use it on Shabbos?","
The electric kettle should be turned off before Hatoras Nedarim.</s>","
Generally, it is recommended to have a Hechsher on urns with a thermostat for Shabbos use, as there might be an issue with removing hot water from the urn, causing the remaining water inside to cool off faster, ultimately effecting the urn to boil faster.
However, I should mention that there are some inconclusive tests that suggest that even urns with thermostats do not act in such a way. They have proven that the heating element doesn’t use more power or get activated sooner.
See also here (Paragraph “Does Removing Water Cause the Urn to Activate”).
Regarding using urns which have a gauge indicating how much water there is – see here:"
" Does a room which will soon be transformed into a bathroom need a Mezuzah?
I designated a room in the building to be a bathroom. But we won’t be doing the job for a few moths or a year. In the meantime we are storing things in there till we get around to doing it. Should a Mezuzah be put there till then?","
Yes.</sm>","
No."
" Besides the five candles that a Chiyuv lights by the Amud during Davening, must two candles be lit regardless?","
The Rebbe did not mention anything about this. There is no source in Chabad for it either.</s>","There should be always two candles lit by the Amud. If there are five candles burning there, as per Chabad custom, that is sufficient.
See also here:
What’s the Makor to light two candles by the Shtender of the Shliach Tzibur? Is this Minhag Chabad?"
" If I have a baby on Shabbos, can I have a nurse call my parents and leave a message on the answering machine?","
You may do so.</s>",This should not be done under normal circumstances.
 Can one use hand sanitizer for Mayim Achronim?,"
One may not.</s>","Permitted.
There is however room to be mehader, though not halachically required, to use only liquids that are suitable for animal consumption.
P.S. it should be noted that Minhag Chabad is to pass the fingers over ones lips after washing the fingertips (Hayom Yom 4 Kislev)."
 Is craniosacral therapy Okay to do according to Torah?,"
It is permitted and encouraged. There’s no halachic reason not allowed.</sleep>","When addressing alternative medicine, an important point to consider is whether these methods are actually proven to help in a scientific way (whether logically or illogically). Many of these methods have already been discussed by recent Poskim, and there are different opinions on the matter.
Generally, the Rebbe discouraged use of such methods. In the Rebbe’s words:
“With regard to your question about using the services of Mrs. … who heals without using any healing remedies at all: Inasmuch as “Torah has granted permission for the healer to heal,” I don’t understand why one should pursue unfathomable paths.”
(Igros Kodesh, Vol. VII, p. 303).
(See also Igros Kodesh vol. XVIII p. 17: “Why is he seeking out new methods and new matters when we have the paved path of Torah and mitzvos”).
See here at length: Chabad.org/Alternative Medicine in Jewish Law
Though for a person who’s exhausted finding help in traditional medical remedies, there might be some room on occasion to allow the use of alternative ones, and even those with a sketchy track record (see here), initially, help should be sought out at traditional physical and mental health professionals, which have a proven track record and are halachically regarded as doctors to the extent that one may be Michalel Shabbos (if needed) based on their opinion.
Thus, my opinion is that although this method is not definitively Asur, it should be avoided based on the above points.
For a general analysis of the issues involved, some which apply to this method see here:
If I work as an energy healing (Reiki) practitioner, may I work on women?
See also:"
 May one kiss the Mezuzah before washing their hands after leaving the bathroom or touching shoes etc.?,"
One may not.</s>",If the mezuzah is covered it is permitted. Best to rub your hand against something first.
Soup spilled over from a bowl containing hot chicken soup onto a parve glass baking dish. It may also have sprinkled onto a parve metal cooling-rack beneath the baking dish (but we are not sure).The soup had been taken with a metal ladle out of a kli rishon which was off the fire and then put into the china bowl. The bowl was then carried above the airspace of the baking dish when the spilling occurred. Does the glass baking dish need to be kashered back to parve? Can it be? and what about the metal cooling rack? Is that now fleishig?,"
If there is no doubt in your mind as mentioned below – this does require tevillah.</s> If however one can’t tell for certain if any part got on top or fell underneiderech/beside etc., everything needs full taharas mikvaos again including even those parts whose status could only possibly come up by chance because they were very close together such at all 4 sides where possible touch but still weren't directly next to each other - unless otherwise stated hereinbelow regarding specific cases like these ones listed further down; see notes within brackets throughout.]</r></p><!--end-->","
The glass should ideally be kashered by either putting in oven or hagolo. (Even though in general custom is not to Kasher glass, in this case it’s okay).
For the rack, you can put it into a oven on high setting for a few minutes to Kasher."
 May one mention the actual name of Yoshke?,"
No.</s>","The second name (Ch-) may not be be mentioned.
As for the first name (J-), the common custom for generations is not to mention it either, rather using a nickname such as Yoshka, Oso Ha’ish etc. One should not deviate from this custom.
See also:
Cities Named after A Priest"
 Is intimacy permitted on Nittel night?,"
Yes.</s>","It should be deferred to a different night. If it is Mikva night, one should wait till after midnight."
" May one spill water from his cup prior to drinking on Shabbos?
Many are accustomed to spilling a drop of the “bad water” off their cups. May one do so on Shabbos, as it is forbidden to remove bad from good?","
Yes.</s>","
Permitted on Shabbos."
" If there was no Minyan for Kabbolas Shabbos, and then a Minyan came after Shmone Esrei, can Kaddish and Barchu be said before Aleninu?","
No.</s>","Yes, provided there was a minyan for mizmor l’dovid."
 Can I make a Siyum Mishnayos for a Yortzeit on Shabbos?,"
No.</s>","A Siyum isn’t made on Shabbos.
As for the custom of learning Mishnayos on the day of the Yartzeit, the common custom is to do so on Shabbos."
" What should be done with the peppers from Eretz Yisroel?
We received a package of different color peppers, and on the red ones have a sticker that says it’s from Israel. What do we need to do with all the red peppers?","
The common custom is not eat them.</sm>","
The dinim of Shmitah and the way they apply in Chutz La’aretz can be complex, but to summarize:
Fruits: Fruits grown in Eretz Yisroel during the year of Shmitah, even if grown without any human effort, have a level of holiness to them and may be only eaten in a certain way, may not be disposed of when still edible, and for most fruit, must be made hefker at a certain point of the year (known as the zman biur) etc.
Vegetables: Additionally, the Chachomim decreed well as that all vegetables grown during Shmitah, even if grown without any human effort, may not be eaten at all, even in Eretz Yisroel. This is known as the prohibition on Sefichei Shvi’is. The reason for this prohibition was that since vegetables can be harvested not too long after planting (as opposed to fruit trees which can take years to mature,) we are worried that unscrupulous individuals will plant vegetables during Shmitah and claim that they just grow on their own.
They also ruled that Shmitah fruit may not be removed from Eretz Yisroel (even though they retain their holiness when removed).
Therefore, since we cannot be sure that the red peppers, were grown and harvested before the start of the year of Shmitah, they may not be eaten. However they may not be discarded either, since they retain the holiness of Shmitah. Therefore they should be left in their place to a point which they are no longer edible,(at which point they lose their holiness,) and then they may be discarded normally.
See also the following notice from our Vaad Hakashrus:"
" Are you allowed to demolish a non working chimney?
Are you allowed to demolish a non working chimney (which starts from the ground all the way up to the roof)?
I have heard that it may be problematic based on tzava’as Rabbi Yehuda hachosid.
Would I be able to demolish it and put a small pipe (in the place of the chimney) which comes out on the roof instead?","
It is not an issue.</s>","
Since you are not totally sealing it and rather placing a pipe in its place, it would be ok."
 How should a Bris for twins be done?,"
The Rebbe mentions that there is room here also in order not only with respect of health reasons but because it’s better this way. So if possible both babies must come out one by another.</snip>","The following is the common custom: The two children should not be brought in at the same time. One child is brought in first and a the mohel performs the bris on him. After a short break, the second bris is done and the same mohel performs the bris on him making a new bracha."
" Is there a problem to call someone by only one name if they have two names?
Is there a problem to call someone by only one name if they have two names? For example: if someone has the name Yosef Shlomo, can you call him just Yosef? Because someone told me that he saw in a sefer somewhere that you shouldn’t.","
There is no issue with this.</s>","
There’s no problem in doing so. However one must ensure that the second name does not get “lost” and assume the status of a shem shenishtaka. As long as the second name is still used for aliya l’torah, mi shebeirach etc., it’s not a problem.
See also here:"
 Can one take bones directly out of fish on Shabbos?,"
No.</s>","One may remove small bones while eating. This applies only when the bones are still connected to the fish. Non-attached bones, i.e. once the bones have been removed, may not be removed from the plate.
The spine or large bones should not be removed. One should remove the fish from it when eating."
" What is the Bracha on hydroponically grown vegetables that don’t use soil at all?
Is it shehakol because it didn’t actually grow in the ground, or is it ha’adama because it is a min that typically grows in the ground?","
It would be HaAdoma.</s>","
Shehakol."
" May one write G-O-D in English, or is a hyphen necessary? And is it the same Halacha when writing on a computer?","
You may do so.</s>","The Rebbe was of the opinion that it should be written with a hyphen.
There wouldn’t be a problem with typing it on the computer, so long that it’s not printed."
