question,actual_output,expected_output
 May I use Maaser to buy Mishloach Manos to give my students?,"###question 
  May I use Maaser to buy Mishloach Manos to give my students?.
 ###answer 
 
Yes.
See here:
Can I use Maaser to buy Mishloach Manos for my students?
See also here:
Can I use Maaser to buy Mishloach Manos for my students?
See also here:
Can I use Maaser to buy Mishloach Manos for my students?
See also here:
Can I use Maaser to buy Mishloach Manos for my students?
See also here:
Can I use Maaser to buy Mishloach Manos for my students?
See also here:
Can I use Maaser to buy Mishloach Manos for my students?
See also here:
Can I use Maaser to buy Mishloach Manos for my students?
See also here:
Can I","One is obligated to send two Manos to at least one person. This obligation cannot be fulfilled with money from maiser.
The same applies if there is a cultural, communal or institutional expectation that you give your students – it may not be given from maiser.
Also, if one already committed mentally to give these extra Mishloach Manos from their money, they may not later decide to use maaser money.
If one is accustomed (for three years) to be particular in being mehader to give extra Mishloach Manos (to a certain amount of people) it becomes a binding vow and maaser money may not be used.
In all other cases, if one wants to add onto the basic obligation, and send to another two more people (but not more), it is considered a voluntary mitzvah and maiser money may be used, provided that one cannot afford otherwise to pay for it and that the mishloach manos is reasonable and not extravagant.
It should be noted that this addition is considered a hiddur mitzvah. If one is choosing a hiddur, It would appear that it’s much more mehudar to give this money for poor people instead."
 Is one allowed to eat Hamotzie before Davening?,"###question 
  Is one allowed to eat Hamotzie before Davening?.
 ###answer 
 
No.
See here:
Can I eat Hamotzi before davening?
See here:
Can I eat Hamotzi before davening?
See here:
Can I eat Hamotzi before davening?
See here:
Can I eat Hamotzi before davening?
See here:
Can I eat Hamotzi before davening?
See here:
Can I eat Hamotzi before davening?
See here:
Can I eat Hamotzi before davening?
See here:
Can I eat Hamotzi before davening?
See here:
Can I eat Hamotzi before davening?
See here:
Can I eat Hamotzi before davening?
See here:
Can I eat Hamotzi before d","There is a prohibition to Kovaya Seuda before davening in case they might forget to daven before the zman tefilla, however, one is allowed to snack on fruits and other foods and eat bread or mezonos up to a beitza (2 kzaysim).
Before Shacharis, one may not eat at all. If not eating disturbs one’s kavanah in davening, one may be lenient to eat before Shacharis. Chassidim would be particular to eat before Shacharis in such cases. But since the purpose was not to be kovaya seudah they would ordinarily eat mezonos and not bread. Bichlal, one may not eat more than a kebeitza. Generally, Mashpiim in Lubavitch preferred mezonos over bread.
Q. Is there a difference between men and women?
A. There is room to be meikel for a woman since there is an opinion that woman can fulfill their chiyuv of Tefilla with a short bakasha, a request of Hashem, in the morning."
 Can I work for Uber eats and pick up food from non-kosher restaurants and as well deliver the non kosher food to Jewish houses?,"###question 
  Can I work for Uber eats and pick up food from non-kosher restaurants and as well deliver the non kosher food to Jewish houses?.
 ###answer 
 
No.
See here:
Can I work for Uber eats and pick up food from non-kosher restaurants and as well deliver the non kosher food to Jewish houses?
See here:
Can I work for Uber eats and pick up food from non-kosher restaurants and as well deliver the non kosher food to Jewish houses?
See here:
Can I work for Uber eats and pick up food from non-kosher restaurants and as well deliver the non kosher food to Jewish houses?
See here:
Can I work for Uber eats and pick up food from non-kosher restaurants and as well deliver the non kosher food","No.
Serving a Jew non-kosher is prohibited, because of: לפני עור, מסייע, חיוב תוכחה, מחאה, כל ישראל ערבים זה לזה.
It is prohibited to eat, cook or benefit from a mixture of milk and meat. Thus it would be prohibited to deliver, even to a non-Jew, any food which contains such a mixture.
There is the aspect of Mar’is Ayin entering into non-kosher restaurants.
יו״ד סימן פז."
 Article: Do I have to fast?,"###question 
  Article: Do I have to fast?.
 ###answer 
 
If you are not yet married, you should fast on Erev Tisha B’av.
If you are married, you should fast on Erev Tisha B’av if you are not pregnant or nursing.
If you are pregnant or nursing, you should fast on Erev Tisha B’av if you are not yet married.
If you are not yet married and are pregnant or nursing, you should fast on Erev Tisha B’av.
If you are not yet married and are not pregnant or nursing, you should fast on Erev Tisha B’av.
If you are married and are not pregnant or nursing, you should fast on Erev Tisha B’av.
If you are not yet married and are","The most stringent of all fast days is Yom Kippur, since fasting is min haTorah (a Biblical law), as the passuk in Parashas Acharei Mos says: “Ta’anu es nafshoseichem” (afflict your souls)—and the severe punishment for not fasting is kareis (early death by Divine decree). Only a heter (dispensation) dispensed by a rav in critical circumstances and in a strictly prescribed manner would allow breaking the fast. A choleh she’ein bo sakanah (a person who has a non-life threatening illness) and similarly, a woman who is expecting or nursing (under normal circumstances), must fast.
Four other fasts are rooted in divrei kabbalah (the words of receiving, i.e. from the Prophets): Tzom Gedaliah, Asara B’Teves, Shiva’a Asar B’Tammuz and Tisha B’Av, and they are subject to stricter rules than for other laws mi’d’rabbanan (of Rabbinic origin). (Taanis Esther is in a different category of minhag—custom.)
Tisha B’Av, due to its history of huchpalu bo tzaros (double tragedies), is more stringently observed: We begin fasting at sunset the evening before and observe the additional bodily afflictions as on Yom Kippur. But the other three fasts of divrei kabbalah are more minor; they were instituted for calamities associated with the churban (destruction [of the Temple]) and during times of relative peace afterwards were commemorated only as a standing tradition previously accepted by Klal Yisroel (the Jewish people).
One of the leniencies of these three fasts is that an expectant or nursing mother who is mitzta’eres harbeh (in much physical discomfort) does not have to fast. Poskim state that lav davka (not necessarily) must the discomfort be acute—even some difficulty suffices as a heter. By contrast, a choleh she’ein bo sakanah, and similarly, an expectant or nursing mother who is suffering undue weakness or one who is at a stage of her pregnancy where fasting is deemed unhealthy for her (or for the fetus) and would therefore be considered a choleh—is patur (exempt) from fasting on all four fast days, including Tisha B’Av.
A mother of small children who is not expecting or nursing is not included in this heter, and neither is one who is paid to care for others’ children, as there is hardly a career or calling that exempts an individual from the halachic obligation to fast. One halachic opinion states that women should not have to fast for twenty four months after giving birth (the official halachic time span for nursing) and another exempts all those of childbearing age, but these views are rejected by mainstream poskim.
There is some extra leniency regarding Tzom Gedaliah (compared to the other two fasts of divrei kabbalah) for those who are not otherwise exempt, but would not be physically able to fast on Yom Kippur only one week after fasting on Tzom Gedaliah. In such a case, a rav should be consulted.
From Halacha2Go Archives"
 Is there a possible problem with using pots and pans that having a non stick coating?,"###question 
  Is there a possible problem with using pots and pans that having a non stick coating?.
 ###answer 
 
There is no problem with using pots and pans with a non-stick coating.
However, one should be careful not to use metal utensils on a non-stick coating.
See here for more details:
Can I use metal utensils on a non-stick coating?
See also here:
Can I use a non-stick pan on a gas stove?
See also here:
Can I use a non-stick pan on an electric stove?
See also here:
Can I use a non-stick pan on a ceramic stove?
See also here:
Can I use a non-stick pan on a glass stove?
See also here:
Can I use a non-stick pan","New (without a Hechsher):
There is no Halachic problem with new Teflon pots (after Kashering them – see link below)
Some, however, have a Hiddur to avoid using new Teflon pots for Pesach. Some even avoid using it throughout the year too. These are not Halachically mandated.
Used:
If they were used for Treif, they should not be Kashered.
Similarly, if they were used throughout the year for Chometz, they should not be Kashered and may not be used for Pesach."
"As things look, it seems we may need to be making Pesach at home this year. Since Mikvaos are closed, how can we go about doing tevilas kelim for the new utensils we buy?","###question 
 As things look, it seems we may need to be making Pesach at home this year. Since Mikvaos are closed, how can we go about doing tevilas kelim for the new utensils we buy?.
 ###answer 
 
You can use a mikveh that is open for tevilas kelim.
If you don’t have access to a mikveh, you can use a kosher mikveh app.
If you don’t have access to a mikveh, you can use a kosher mikveh app.
If you don’t have access to a mikveh, you can use a kosher mikveh app.
If you don’t have access to a mikveh, you can use a kosher mikveh app.
If you don’t have access to a","
For the time being, if there are no places available to tovel keilim, one can give to a non Jew and then borrow it from them. This exempts the dishes from tevilah for the time being. This is not a solution long-term. After such time that it becomes possible to immerse the dishes, one should do so without a blessing.
ראה שו״ע אדה״ז שכג, ח.
Giving the item to a non-Jew is as simple as having the non-Jew lift the item. If this is not possible one can use this form to transform ownership to a non-Jew for a 30 day period, but it is best not to rely on this option for several reasons."
