question,actual_output,expected_output
" Should I make a Bracha on the liquid of a instant noodle soup?
When I finish eating an instant noodle soup and now there is mostly water (but still a few noodles), do I have to make a shehakol on the water? and what if there are no noodles? Would it make a difference if I already ate the first part of the soup or not?","
You should be Machmir in making Shehecheyanu.</s>","
If you drink the soup before eating the noodles: if it was cooked for the normal amount of time as per the instructions on the package, which would give taste of the noodles in the water, you should make Mezonos.
You should avoid drinking the soup before eating the noodles if it was cooked briefly, because it is not clear what the Bracha would be.
After eating the noodles, you do not make a shehakol even if you drink the soup alone, and even after you finish all the noodles, regardless of how long it was cooked."
"I was taught that as Chazzan on Shabbos, by Hotzaas Sefer Torah, the pesukim Shema Yisrael and Echad Elokeinu should be said facing the crowd, while Gadlu should be said facing Mizrach. Is there a source for this?
Also, regarding the Minhag to raise the Torah slightly when saying Gadlu, I’ve heard different opinions whether it should be raised by the word “Gadlu” or by the word “uneromemah”. Is there any clear directive on this?","
The custom of raising one corner during shmone esrei is mentioned in several places.</s> However they were all referring only to kedusha</span>. In regards with gomeil vortshaft we don't have such sources which would require us not lifting up our eyes from reading Krias Hatoraha until after davening has ended unless specifically instructive like above cited minhas hassamayach examples; therefore if possible preferably before barchu at least once throughout tefilla even without looking away but otherwise lift your head right afterwards immediately upon finishing omerei mikol yudaiya so no confusion will arise between what exactly happened here especially since people often take their time taking out tzitzes etc., making sure its properly tied down again instead rushing back straightaway into actual prayer – thus avoid creating unnecessary distraction/confusion amongst those around them who might think he just finished prayers altogether due mainly because his face wasnâ€™	... [more]","
1. There are various minhagim. The general minhag is as you mentioned.
2. There is no indication to do so during a specific word, other than when reciting this Pasuk, as well as during the pasuk of Shema Yisroel and Echad Elokeinu."
"If a minyan finished davening (and concluded final kaddish derabanan) and someone in the year of aveluis arrived and wanted to say a kapital tehilim and kaddish yosom and there was no other minyan in town for him to catch, is there an issue with that?","
There would be issues.</s>","
There is no issue with it, but not following a previous Kaddish after Tehillim. In such a case, it would be better to say Mishnayos and kaddish derabanan."
" Is it my obligation to inform the Shul’s management that this act is prohibited?
I passed by my Shul’s Mikvah this past Friday night after davening, and I noticed that there was a steady stream of dryer exhaust/steam coming out of its windows. It was clear that a clothes dryer was in use. This happened two hours after sunset, which means that the Goyim clearly started the cycle on Shabbos.
While I know that if a Goy is paid a lump sum to do something every day, including Shabbos (Bihavla’ah), and there is no enjoyment immediately being derived from his actions, then that is fine, however – shouldn’t this case be judged as an act of “Meleches Goy Bifarhesia” which is prohibited due to Maris Ayin?
And if so, is it my obligation to inform the Shul’s management that this act is prohibited?","
You should definitely bring up your concerns with them.</em>","
Though this should not be done, you have no obligation to inform the shul, unless you believe they will actually listen."
" Should one say Modeh Ani when waking up in middle of the night?
When waking in the middle of the night, we wash negel vasser. Are we also supposed to say Modeh Ani, or is that only when waking in the morning?","
You should not recite modein aneim.</s>","
Yes, you are supposed to say it."
" May a mother hold, kiss, gaze at, or take a picture of her stillborn?","
There is no prohibition.</s>","None of the above should be done. While looking momentarily is not a problem, one should not gaze intently at the deceased.
Rabbi Yehuda Hachasid writes that parents should not kiss their child who passed way and that this could be quite dangerous. Many poskim extend this to anyone kissing the dead. Furthermore, many poskim mention also not to hold the child.
In the case where this might be deemed therapeutic for the mother, a Rav should be consulted to determine whether it would be acceptable. It should be noted that there are conflicting studies whether contact with the stillborn is deemed to be beneficial for the mother or the reverse."
" Is it correct to place a Sefer -such as a Chumash, Tehillim or Siddur- in one’s lap – especially if one is not at a table?","
Yes. It may be done.</sleep>","Permitted. However, one shouldn’t rest his elbows on it."
 Does all Mishnayos need to be learned to make a Siyum HaShas?,"
All masechta must have been heard and reviewed. It is best that at least one complete chapter of each sefer has also had this status.</s>","No, though it would be ideal to include them too."
" Aliyos Shabbos before Yud Shvat: Can we remove two Sifrei Torah from the Aron at once?
When making more than one Kriah on Shabbos (such as on the Shabbos before Yud Shvat) – is there a problem to remove two Sifrei Torah at once at the moment of Pesichas Ha’Aron, just like it is done when two Sifrei Torah are used (like on Shabbos Rosh Chodesh)?","
If they were not yet in place or if someone didn't see them and doesn bechelkta. Otherwise only after all other kedoshim have been removed.</s>","
It’s allowed."
Just had my Tefillin checked by the Sofer who mentioned there were unusual larger spaces in some of the words. But he said they are kosher. But the question is if they are “mehudar״ for a chosid? Wanted to ask your opinion. See attached pic.,"
The lettering must be perfect and precise.</s>","
Yes, they are."
" What is my Jewish name?
My husband was not given any Jewish name at birth and at his aufruf before our wedding, he was invited to choose a Jewish name. In our ketuba, his secular name was written followed by the Jewish name he chose.
There is some confusion as to what his Jewish name is. Would his Jewish name be what is written in our ketuba? (Secular name followed by the Jewish name he chose?)
Or is it only the Jewish name he chose?
I should also mention that he doesn’t go by his chosen Jewish name regularly- – only for Jewish situations, like when people daven for him etc.","
The Jewisn names mentioned on your Kesubah would take precedence over all other sources.</s>","
His Jewish name is only the actual Jewish name he chose."
What is the halacha in this case?,"
One should be stringent and not use it. If there’s no other option one may.</s>","
The water may be used.
P.S. The goy may only be called to turn on the fuse due to the extremely cold weather and need for heating, especially with little children.
He may also be called to turn on lights if rooms are very dark where there are little children. This wouldn’t usually apply during the day."
" Can we buy stemmed glasses for our public Seder?
We’re buying glasses for our public seder. For a number of reasons, the stemmed glasses are more desirable (nicer, cheaper, and overall more a keepsake). Is there a minhag to have only stemless?","
There is no requirement in halacha that they be without stems.</s>","
Chabad custom is not to use stemmed wine glasses, though it’s not halachically problematic."
" When a man lights Shabbos Candles, when does he make the Bracha?","
The blessing should be made after lightening. However if one lit candle first and then remembered about it – there is room for doubt whether this constitutes “lightning” – in such case we would say that only afterwards can they recite Shehecheyanu.</s>","Before lighting (although some say same as a woman, after the lighting)."
 Does one strike ones chest for Tachnun by Kriahs Shema Al Hamitah?,"
No.</sm>",Yes.
"We would like to invite a family for the Shabbos day meal. However, they have a 15-year-old son and 2 daughters ages 11 and 8. We have a 13 y.o. son and a 14 y.o. daughter. Would it be acceptable to host this family for the meal –are they boys/girls of the two families too close in age to be at the same table?","
Yes.</s>","
While technically it’s not forbidden to host single bachurim and girls at the same meal, this is considered inappropriate. One should go to great lengths to arrange their hosting of meals in such a way that bachurim and girls aren’t invited at the same time. Rumor has it that the Rebbe instructed that Yeshivos not allow bachurim to eat out at families who have girls home, even if they are little girls.
The general age for when to separate kids is when they start maturing to understand the concept of separation between men and women. This is generally between the ages of 6 and 9. Children of 9 years and older, must be educated not to mingle and should be seated separately.
Where circumstances require such an arrangement, they should be seated at different tables.
Please see here for more details:
How to properly arrange the seating at the Shabbos meal?"
 Is it a problem to Daven Mincha on Shabbos before Kiddush?,"
Yes. You should wait until after kids’ challah.</s>",No.
" Is it permitted to benefit from the light on Shabbos if someone turned it on by mistake?
If someone turned on the light on Shabbos by mistake (either by bumping into the switch, or they forgot it was Shabbos) is it permitted to benefit from the light?
And what would be considered benefitting? (Would it make a difference if there was already some light before? Or if they need the light…?)","
Yes. However one may not cause something that wasn’t done intentionally.</s>","
It depends. If someone forgot that it was Shabbos, he and others may not benefit from the lights until after Shabbos. If however, he bumped into the light then it is permitted to benefit.
The definition of forbidden benefit is to do things using the light which otherwise wouldn’t be possible. If this isn’t your home, it is best to leave the house"
" Is it true that it’s a Segula for Arichus Yamim (long life) to write a will?
If yes, is there a point in one’s life where it would be inappropriate (such as when newly married or below a certain age)?","
It isn't considered appropriate. However some say its good.</sleep>","
True.
While one may write a tzavaah even earlier, usually it is done after 50."
" Is there any halachic preference between a natural birth versus using an epidural?
(i.e. for someone who has BH until now had smooth natural births but still has fear of the pain in childbirth)","
The general opinion is that one should try as much possible not use drugs during pregnancy and labor.</s> However if it’ll cause danger or harm then they may be used under supervision with proper guidelines set by your physician and/or rabbi – such was done when I gave birching my children too!</p></div><br clear=”all “>. It appears from this article on Jewish Childrens Network website about what Rabbi Avraham Scheinberg ztkl said regarding whether women can give their newborn baby CPSV vaccine while breastfeeded; although no direct reference herein made specifically towards giving Epi-Dur at delivery time via spinal injection directly into mother through her back without passing blood brain barrier…it does seem implied so because he says we needn't worry re bacterial contamination since mothers donations have been tested already beforehand etc., which would suggest applying same logic above also applies whereby just like cpsv isntead given after moms milk comes out naturally - similarly other medication injectable substances could enter mom thru skin & muscle tissue even though technically speaking entering straight intravenously might pass more quickly thorough body system<sup class=""reference"">1[ref]Especially considering all types including Heparan sulfate proteoglycans found within human placenta itself do cross protective membranes overlaid onto maternal side providing additional safety layer against potential infectious agents transiting across these layers both ways ibid ref 2 [3]. In fact some studies show evidence suggesting its very likely antibodies derived either form fetal circulatory fluids flow throughout entirety uterus especially around cervicovagina area along epithelium lining surface near umbilical cord attached base point originating right behind abdominals thus allowing","
There is no halachic objection to using an epidural where there is a need to do so."
"I’m wondering, if I can open one knot then the last one won’t be a double knot but all 8 strings will be sticking out? If the fifth knot is not doubled is that meakev?","
The Rebbe explained in an interview with Rabbi Mendel Futerfas how it works. See here.</s> You may make kiddush on them as soon after tying your shoes and before walking around without removing anything from what was tied at least once while wearing these sneakers or boots for men which have laces – provided they were already tightened twice prior</p>. This applies even though there isn'the actual fivefold blessings over each pair of two loops since only four pairs exist; however when davenning birkas hachachaim this should also include mention about those who tie their shoe-laces because hey did so too – otherwise no tefillah would apply either! The same holds true regarding women whose garments contain multiple folds/knotting unless specifically mentioned by name during recitation aloud amongst themselves e g., sister(h), mother etceteri;</em></span><wbr/>This halochoh does indeed require specific verbalization throughout our daily activities such us getting dressed every morning including putting together pants under skirt along side jacket top blouse bottom stockinng belts scarf hat gloves slippers sandals flip flops loafers moccasins clogs ballet flats running shows jump rope skipping hula hoop hopscothops swimming pool shower curtain bathroom door front entrance hallway staircase landing elevator platform subways trains bus station taxis rickshaws scooties motorcycles cars truck vans pickups jeeps SUV minivan limousine helicopter airplane private jet commercial flight Boeing Airbus A320 aircraft DC19 KC46 MD57 Puff Daddy Limo Lincoln Towncar Roll Royce Bentley Maybach Mercedes Benz S Class BMW X series Range Rover Porsche Cayman Lamb","
Bedieved only, when you can’t find a different pair of Tzitzis."
"Do we still hold by this as a practical thing to do nowadays, and if so does that also include the half-day fasts that he mentions?
The Alter Rebbe distinguishes between the extra fasts, in accordance with the number of times the sin was done total, and the actual fasts totaling the number corresponding to the particular sin.
Although he goes into the whole thing about “only a healthy person etc.”, that was in regards to what he said about the Mekubalim who say to do 3 times the total, then he says to redeem them in tzedakah.
But then he says to complete the total amount at least once in one’s life, to push it off to the short winter days, and for the other number (totaling 3 times the standard amount) to do half-day fasting, and then to be stringent according to the other opinion, to redeem all of the extra ones (that add up to the total multiplied by each time) with tzedakah.
Do we still follow this “baal nefesh” thing nowadays?","
In general there is no need today even when someone has not yet completed his full quota – unless they have specific reason such an illness or old age.</nowiki> </dfn></dt><dd class=""mw_collapsible mw__when"">Most probably though everyone should try their best effort possible every year without exception until reaching retirement years; especially since after many sins were forgiven due only because people repented from those things which brought on these punishment through Toras Chaimos - see Shulchan Aruch OC Choshen Mispat Siman Kaf Bet page #258 where Rema writes exactly how Hashems anger subsides slowly over generations regarding Am Yisroel' amassed wealth during Galus Bavel! In addition seeing our generation being less observant than previous centuries makes us more susceptable towards suffering Divine Punishing forces too whenever HaSham comes upon humanity collectively like He did before WWII & afterwards throughout history often enough causing massacres including Holocaust against Jewish People worldwide making Jews move around frequently seeking shelter again along its cycle till Messianic Era will come soon…..& may Moshiachos arrive speedily very much indeed within next decade!! See below some examples listed chronologically showing common patterns among nations/generation concerning similar cycles taking place repeatedly while always finding excuses justifying new ways leading further away gradually but consistently moving closer toward eventual destruction regardless whether war broke out nearby first nation involved amongst others alike across borders sometimes involving neighbor countries right beside your own country undergoing unprecedened circumstances simultaneously facing massive catastrophes beyond anyone living experience level thus far known globally except few individuals surviving hereby continuously learning vital skills required adaptive strategies essential tools needed most urgingsly necessary qualities enabling communities enduring resilient mental fortitude strengthening character steadfast","
Nowadays, personal fasts are not recommended.
The Alter Rebbe writes in the third chapter of Igeret HaTeshuvah that fasting – with the exception of mandatory public fast days – must never come at the expense of one’s health or strength. If fasting will weaken you to the extent that you will not be able to serve G‑d that day with the same energy and vigor as you would have had you eaten—don’t. In fact, the Talmud is very clear about this: One who fasts despite the fact that it weakens him, is called a sinner.
In today’s day and age, when most of us are used to eating three round meals a day, there is almost no one who can claim to be unaffected by fasting.
More importantly, it is the spirit of repentance, the true repentance, that comes along with fasting that counts.
Rather, instead of fasting one should do as the Alter Rebbe brings from the words of Daniel, when advising Nebuchadnezzar: “Redeem your sins with charity, and your wrongdoing by being kind to the needy”. This can be done by donating to a charitable cause the monetary value of the food you eat on a given day.
The Rebbe explains that our generation is even weaker than the Alter Rebbe’s time and accomplishes even these fasts that he permits through tzedaka."
 Can one say a Bracha if there is a clean child’s potty in the room?,"
If it was used by someone else and not wiped off properly or covered up then yes. If otherwise no.</sm>","If it’s made out of plastic and doesn’t give off a smell, yes."
 Could I walk outside on Shabbos with my retainers on my teeth? (my dentist told me to wear them the whole day),"
No.</s>",Yes.
 Is a Shofar holy? May one bring it into unholy places?,"
A shophark is not considered as if there’s holiness in any part of its body. It can be brought and blown even on Saturdays.</p>","If it was used for a mitzvah and is still suitable for mitzvah usage, it should not be used for mundane matters and certainly not for improper usages. One should not bring it into unholy areas."
" Is it Halachically wrong to tell a parent that you feel they hurt/insulted you?
Is it wrong according to halacha to tell a parent (respectfully) that you feel they hurt/insulted you?
If a parent doesn’t seem to be understanding the child (I.e. a teenager or a young adult in shidduchim) but they overall have a good relationship, what’s the best way according to halacha to go about expressing this while still remaining respectful and not contradicting what they say.","
A Rebbe once said something like “It is better for one who was insensitive towards others when he knew how much his words affected them – even if only slightly - than someone else whose feelings were always on their sleave.”</p>","
One must be extremely careful not to embarrass or get angry at their parents. If you feel that they insulted you or don’t understand you, and you know they would want to hear about it, you may bring it to their attention with the utmost respect. The correct way to express it would be to express your feelings without blaming them. Although this may be challenging (as you may feel hurt etc.), doing so is fulfilling a great mitzvah of honoring one’s parents."
 Is one allowed to make a Shehechiyanu on fresh guava if they had dried guava that season?,"
If it was eaten raw or in its natural form and not cooked/cooked into something else. The same applies for other fruits such as apples.</s>",Yes.
" Is Emanuela a Jewish Name?
Hello Rabbi, hope this email finds you well! We are expecting a new addition to the family and are having some trouble finding a name that we like in the case of a girl. We of course want a Hebrew name. I really love the meaning and sound of the name Emanuela but whenever I look it up, I find that its origins contradict depending on the website. Some people claim it’s Hebrew while others say it’s Spanish. I was hoping you could maybe shed some light on the situation and give me a definite answer as to whether this name is Hebrew or not. Thank you so much and have a wonderful day!!","
The word “Emanuel” comes from Aramaic language where אמנול means God with us; thus there should be no problem using such names.</sm>","
It’s both. While it’s origin is Spanish or Italian (Roman), it’s also a modern Hebrew name. It has become the feminine version of the Hebrew name Emanuel. The original masculine version, Emanuel has extremely ancient roots in Judaism, already in the Tanach.
While there’s nothing wrong with the name Emmanuela being that it’s currently considered a true Jewish name (despite its origin), you might perhaps consider adding another name before Emmanuela, a name with clearly identifiable Jewish origins."
 What Bracha do you make on oatmeal upon which you poured hot water from an urn through Irui?,"
Hamotzie.</s>","In theory, it’s a safek mezonos or haadama and therefore only be eaten in a meal. (Eating a mezonos and haadama food won’t help for the bracha acharona when eating more than a kezayis. See here about a similar situation).
However, usually instant oatmeal is precooked or presteamed. Thus, since the oats were (partially) cooked before it would be mezonos when completing the cooking by pouring hot water upon it."
 What’s the Bracha to eat Mint Leaves?,"
There is no specific brachah for eating mint leaves. It may be said as shehacharim.</sm>","Shehakol, since it’s primary usage is as a spice, not plain."
 Which parts of doing laundry is a woman allowed/not allowed to do on Rosh Chodesh?,"
Washing and ironizing clothes in preparation for Shabbos or Yom Tov may be done. The rest should not.</s>","Spraying stain remover onto clothes – Permitted.
Putting clothes in laundry machine – Permitted.
Turning on the laundry machine – Should be done by someone else (a man, child, or – lehavdil – a non-Jew).
Putting in/turning on the dryer – Both permitted. (Hanging wet clothing is not.)
Folding/sorting clean laundry – Permitted.
P.S.: See more on this topic here:"
"I have been practicing shechita at a halal place and many Muslims wear something that looks like a yarmulke. I have learned that some clients thought I was Muslim and therefore allow me to shecht (it’s totally kosher for a Muslim to eat the shechita of a Jew, but some prefer a Muslim do it, because it’s more “mehudar” in their eyes. Much of the halal meat sold on the market today are treifos from cows shechted by Jews, with a Muslim standing nearby saying his prayer before the shechita). Being that this is the case should I mention to anyone who comes that I am not Muslim, and if I don’t mention this, is that considered genevas daas?
I am doing this for free and the owners are very kind about the fact that in order to be a shochet you need practice, but the customers have no idea that I am doing it. Many customers aren’t halal but just like the poultry and beef/lambs that the halal place owns and raises. Those who want a Muslim to slaughter it come to the back of the production where the slaughter takes place to ensure that a Muslim does it or that they do it themselves. One detail which may or may not make a difference is that the halal place owns the animal but then sells the meat thats been prepared in a halal way to the customers.","
The Gemara says there must always exist an element within your community so one can say its done under Jewish supervision.</p>","
No need."
